{"attestation":{"algorithm":"Ed25519","keyId":"proposer.development-attribution-evidence.development-ed25519","signature":"SN5tsWkth__P5_bkrbQki87ZBxAiVErQv51T7MLuapiyZ0OYVOt1HvS7o3SnlrQAnorSzmAsbIxPuW-HW7QyBw"},"claimBoundary":{"attributionPerformanceClaim":false,"authorizedForResearchEvidence":false,"confirmatory":false,"developmentOnly":true,"publicVisibleFixtures":true},"commitmentHash":"sha256:583fea8371ac7a7b5a68470a535c89adbb5aa9ce8fcc4d4157bea46b7ceac393","commitmentId":"development-attribution-commitment.evidence-v1","corpusHash":"sha256:49f7dcbfaabdc122294b41f30d56f15d5eca6088d7941f07483968bdd58e1a01","occurrenceCount":28,"predictionCount":24,"predictionSetHash":"sha256:530c5393f706f1af06fe084d834cb7ca84dffc4b2b642961af9ac3aa44d1b92d","priorDiagnosticResultsVisible":false,"producer":{"identityDigest":"sha256:1efa7837e4f1abfc8f01b6e0e0c739c2aeef0e45c8024b131b026dd7793d52d1","implementationDigest":"sha256:6f0262217b52918ef9030872585b65aaabea2a01756c6a4842343df8f5fef69e","instanceId":"proposer.development-attribution-evidence.instance","principalId":"proposer.development-attribution-evidence","role":"proposer"},"prototypeManifestHash":"sha256:4eb086841a2f8f95835173a645ac0826e8b74586ffdd2635c40aef824cd78933","publicPrincipal":{"identity":{"identityDigest":"sha256:1efa7837e4f1abfc8f01b6e0e0c739c2aeef0e45c8024b131b026dd7793d52d1","implementationDigest":"sha256:6f0262217b52918ef9030872585b65aaabea2a01756c6a4842343df8f5fef69e","instanceId":"proposer.development-attribution-evidence.instance","principalId":"proposer.development-attribution-evidence","role":"proposer"},"keyId":"proposer.development-attribution-evidence.development-ed25519","publicKeyPem":"-----BEGIN PUBLIC KEY-----\nMCowBQYDK2VwAyEA+kg0FH9uaQw2k+/2EzYEZAPNiuKhTzGzxAc1hWkjlWU=\n-----END PUBLIC KEY-----\n"},"schemaVersion":1,"sealedAt":"2026-07-31T08:01:00.000Z","statusCounts":{"abstained":0,"failure":0,"invalid_output":0,"predicted":24,"timeout":0}}
